{
  "$schema" : "http://json-schema.org/draft-07/schema#",
  "type" : "object",
  "properties" : {
    "@context" : {
      "type" : "array",
      "items" : {
        "type" : "string"
      }
    },
    "credentialSchema" : {
      "type" : "object",
      "properties" : {
        "id" : {
          "type" : "string"
        },
        "type" : {
          "type" : "string"
        }
      },
      "additionalProperties" : false
    },
    "credentialSubject" : {
      "type" : "object",
      "properties" : {
        "gx-participant:blockchainAccountId" : {
          "type" : "string"
        },
        "gx-participant:headquarterAddress" : {
          "type" : "object",
          "properties" : {
            "gx-participant:addressCode" : {
              "type" : "string"
            },
            "gx-participant:addressCountryCode" : {
              "type" : "string"
            },
            "gx-participant:postal-code" : {
              "type" : "string"
            },
            "gx-participant:street-address" : {
              "type" : "string"
            }
          },
          "additionalProperties" : false
        },
        "gx-participant:legalAddress" : {
          "type" : "object",
          "properties" : {
            "gx-participant:addressCode" : {
              "type" : "string"
            },
            "gx-participant:addressCountryCode" : {
              "type" : "string"
            },
            "gx-participant:postal-code" : {
              "type" : "string"
            },
            "gx-participant:street-address" : {
              "type" : "string"
            }
          },
          "additionalProperties" : false
        },
        "gx-participant:legalName" : {
          "type" : "string"
        },
        "gx-participant:registrationNumber" : {
          "type" : "object",
          "properties" : {
            "gx-participant:registrationNumberNumber" : {
              "type" : "string"
            },
            "gx-participant:registrationNumberType" : {
              "type" : "string"
            }
          },
          "additionalProperties" : false
        },
        "gx-participant:termsAndConditions" : {
          "type" : "string"
        },
        "id" : {
          "type" : "string"
        }
      },
      "additionalProperties" : false
    },
    "expirationDate" : {
      "type" : "string"
    },
    "id" : {
      "type" : "string"
    },
    "issuanceDate" : {
      "type" : "string"
    },
    "issued" : {
      "type" : "string"
    },
    "issuer" : {
      "type" : "string"
    },
    "proof" : {
      "type" : "object",
      "properties" : {
        "created" : {
          "type" : "string"
        },
        "creator" : {
          "type" : "string"
        },
        "domain" : {
          "type" : "string"
        },
        "jws" : {
          "type" : "string"
        },
        "nonce" : {
          "type" : "string"
        },
        "proofPurpose" : {
          "type" : "string"
        },
        "type" : {
          "type" : "string"
        },
        "verificationMethod" : {
          "type" : "string"
        }
      },
      "additionalProperties" : false
    },
    "type" : {
      "type" : "array",
      "items" : {
        "type" : "string"
      }
    },
    "validFrom" : {
      "type" : "string"
    }
  },
  "required" : [ "@context", "type" ],
  "additionalProperties" : false
}